<?xml version="1.0" encoding="UTF-8"?>
<!DOCTYPE book SYSTEM "book.dtd">

<booklist>
<book kind ="컴퓨터" id="C001">
<title>자바</title>
<author nation="&kr;">이자바</author>
<author>
<name>홍자바</name>
<nation>&usa;</nation> 
</author>
<price>2000</price>
<publisher>한빛</publisher>
<description>참 쉽죠</description>
<image/>
<qty>100
<price>20000</price>
</qty>
</book>


</booklist>